{"created_at":"2026-07-18T16:36:47.898605+00:00","dataset_version":"cadengbench-p-1800-v2-two-source","multimodal_annotation_package":{"annotation_runs":[],"canonical_frame":{"ambiguity_class":"not_assessed","authority":"source_native","canonical_units":"mm","handedness":"right","orientation_method":"preserve_source_axes_with_declared_unit_scale","origin":[0.0,0.0,0.0],"source_frame_id":"benchcad:native","source_to_canonical_transform":[[1.0,0.0,0.0,0.0],[0.0,1.0,0.0,0.0],[0.0,0.0,1.0,0.0],[0.0,0.0,0.0,1.0]],"source_units":"mm","transform_hash":"3dbf0c8ea80457dec3154a59b00079ab5eea06ac1239e2ec1e2624ac044375bb","x_axis":[1.0,0.0,0.0],"y_axis":[0.0,1.0,0.0],"z_axis":[0.0,0.0,1.0]},"claim_ledger":{"authority":null,"availability":"generation_failed","note":"promotion stage not run","value":null},"completion_record":{"artifact":{"bytes":5093,"path":"data/production/cadengbench_p_1800_v2_two_source_r25/dataset/items/p_benchcad_000338/completion/v2/completion_record.json","sha256":"29f719dc47b7b12a5d25ba545a788b995f10207203ac8334eb1eb2b119c3fcdc"},"authority":"D1_deterministic_geometry","availability":"available","evidence_refs":["data/production/cadengbench_p_1800_v2_two_source_r25/dataset/items/p_benchcad_000338/completion/v2/completion_record.json"],"value":{"artifacts":[{"bytes":6351,"path":"data/production/cadengbench_p_1800_v2_two_source_r25/dataset/items/p_benchcad_000338/completion/v2/parametric/functional_edit_contract.json","sha256":"10de92085d0f66cd867e80b8fed21e42d80ddf5ecd40d44dab7e9def2c8ec04d"},{"bytes":1876,"path":"data/production/cadengbench_p_1800_v2_two_source_r25/dataset/items/p_benchcad_000338/completion/v2/parametric/parameter_space_evidence.json","sha256":"cdce411946fa9b7cf346d056802735eae49b48df4cbbf09fc1120f5c3c2ac799"},{"bytes":11279,"path":"data/production/cadengbench_p_1800_v2_two_source_r25/dataset/items/p_benchcad_000338/completion/v2/parametric/replay_adapter.json","sha256":"c5febb5e86bfe6f599eff921790886282f02d3534d8ab002d56d4fbe15081e36"},{"bytes":5356,"path":"data/production/cadengbench_p_1800_v2_two_source_r25/dataset/items/p_benchcad_000338/completion/v2/parametric/edit_target_oracle.json","sha256":"a951bdb69795ac8ad165de4c2473fd1634e873f28156161913bbcd76df5875b1"},{"bytes":1734,"path":"data/production/cadengbench_p_1800_v2_two_source_r25/dataset/items/p_benchcad_000338/completion/v2/parametric/relations/p_benchcad_000338_relation_target_parameter.json","sha256":"7b84689a6515ac552244ef16f3e0d76badbefa1015973c4cc3335697025ca6c8"},{"bytes":2428,"path":"data/production/cadengbench_p_1800_v2_two_source_r25/dataset/items/p_benchcad_000338/completion/v2/parametric/relations/p_benchcad_000338_relation_candidate_parameter_geometry_binding.json","sha256":"fc12272e088b33ba26843d1230ffd09622656ea574ae22c05d72dd2d68e4e03b"},{"bytes":2397,"path":"data/production/cadengbench_p_1800_v2_two_source_r25/dataset/items/p_benchcad_000338/completion/v2/parametric/relations/p_benchcad_000338_relation_preserve_solid_count.json","sha256":"d1dd5c9f99e1fc68f20a40c24e5b47f236aeeed49f0251a24870a0d184771f38"},{"bytes":1133,"path":"data/production/cadengbench_p_1800_v2_two_source_r25/dataset/items/p_benchcad_000338/completion/v2/parametric/predicates/p_benchcad_000338_predicate_target_parameter.json","sha256":"7e16fc568f0fd8f7ebd4304f083e1990686e2e30cd90b5cec5849991c58e7ce2"},{"bytes":1738,"path":"data/production/cadengbench_p_1800_v2_two_source_r25/dataset/items/p_benchcad_000338/completion/v2/parametric/predicates/p_benchcad_000338_predicate_preserve_solid_count.json","sha256":"6b1a66df4789fb0a676b246f9f0a0f92ef5d7ae8ac74b528a2849553bfeaab00"},{"bytes":1953,"path":"data/production/cadengbench_p_1800_v2_two_source_r25/dataset/items/p_benchcad_000338/completion/v2/manufacturing/evidence_registry.json","sha256":"3aca8128fcbb406378fc81f0c748b2e9d247b7ed7486a4a80d5f12768d325d50"},{"bytes":518,"path":"data/production/cadengbench_p_1800_v2_two_source_r25/dataset/items/p_benchcad_000338/completion/v2/manufacturing/material_card.json","sha256":"24928cd7df3ea36e73b4eca9160d3b3c79b8c4d013bcbac9e25ef031fbe1ef91"},{"bytes":848,"path":"data/production/cadengbench_p_1800_v2_two_source_r25/dataset/items/p_benchcad_000338/completion/v2/manufacturing/process_profile.json","sha256":"3e48e2b8fc9481877b2a406669bb93dceb08edff823b1fccd47efb4b6b0ef065"},{"bytes":889,"path":"data/production/cadengbench_p_1800_v2_two_source_r25/dataset/items/p_benchcad_000338/completion/v2/manufacturing/scenario.json","sha256":"4ed94c1559e59db63255c42ae9a4723929497c91a64709f0d7306fefae93dc4a"},{"bytes":10865,"path":"data/production/cadengbench_p_1800_v2_two_source_r25/dataset/items/p_benchcad_000338/completion/v2/manufacturing/feature_graph.json","sha256":"860ee316346e0ceaa72add2c602a245cf1340b41e10482188692e21b4f46ba74"},{"bytes":1580,"path":"data/production/cadengbench_p_1800_v2_two_source_r25/dataset/items/p_benchcad_000338/completion/v2/manufacturing/dfm_checks/p_benchcad_000338_dfm_body_connectivity.json","sha256":"e36f6f26f8136d7e617bfe2df6a30dda4c93467dde6816b250ff5672d01dd90e"},{"bytes":1819,"path":"data/production/cadengbench_p_1800_v2_two_source_r25/dataset/items/p_benchcad_000338/completion/v2/manufacturing/manufacturing_contract.json","sha256":"d2d92d0a7c4c58741de3869cb0d6d85d55372af45292bd0cec48d40b305f67ee"},{"bytes":15581,"path":"data/production/cadengbench_p_1800_v2_two_source_r25/dataset/items/p_benchcad_000338/completion/v2/lineage/feature_lineage.json","sha256":"ad37957c6747d2ca514e39a2312d3cbb4456446daac84db7bbbb72325457e60a"}],"catalog":{"bytes":19088259,"path":"data/production/cadengbench_p_1800_v2_two_source_r25/completion_catalog.json","sha256":"a8898f9fd816d1404b5b4f0071998374e9c1095f106129b56df19b717d3cb326"},"gates":{"dfm_evidence_gating":"passed","feature_lineage_audited":"passed","llm_judge_used":false,"material_process_resolution":"passed","negative_mutants":"passed","schema_validation":"passed"},"generated_at":"2026-07-18T16:37:26.171824+00:00","item_id":"p_benchcad_000338","schema_version":"cadengbench-p.item-completion.v2","source_authority_boundary":{"native_replay_status":"available","parametric_contract_structurally_valid":true,"parametric_scoring_eligible":true,"proxy_allowed_for_scoring":false,"source_key":"benchcad"},"synchronized_fields":["functional_edit_contract","edit_target_oracle","manufacturing_contract","feature_lineage","completion_record"]}},"conflict_records":[],"contract_version":"cadengbench-p.multimodal-annotation.v2","deterministic_fact_packet":{"artifact":{"bytes":25159,"path":"data/production/cadengbench_p_1800_v2_two_source_r25/dataset/items/p_benchcad_000338/facts/v2/fact_packet.json","sha256":"4bb1c1efbe22a206f97e09386e8a08a33536330280621b574b086062fccfcf59"},"authority":"D1_deterministic_geometry","availability":"available","evidence_refs":["data/production/cadengbench_p_1800_v2_two_source_r25/dataset/items/p_benchcad_000338/source/generated_from_cadquery.step","data/production/cadengbench_p_1800_v2_two_source_r25/dataset/items/p_benchcad_000338/source/cadquery.py"],"value":{"artifact_hashes":{"canonical_step":"5966396bba993c5aaff23d5ebfccacb3ad0cf359fed38e93c721dfeac85e4e0a","native_history":"9b9e97d7eaff549c374e157ea181f855eb4ee9a0482003859c9827fc3fa24f3e"},"bbox":{"diagonal":57.5753542,"xlen":18.476,"xmax":9.238,"xmin":-9.238,"ylen":16.0006854,"ymax":8.0003427,"ymin":-8.0003427,"zlen":52.13,"zmax":52.13,"zmin":0.0},"body_count":1,"center_of_mass_geometry_only":[0.0,-0.0,25.4337964],"constraint_relations":[],"edge_table":[{"entity_id":"edge_0e6131e646da","raw_occt_index":3,"signature":{"bbox":{"diagonal":9.238,"xlen":4.619,"xmax":9.238,"xmin":4.619,"ylen":8.0003427,"ymax":8.0003427,"ymin":0.0,"zlen":0.0,"zmax":0.0,"zmin":0.0},"center":[6.9285,4.0001713,0.0],"geometry_type":"LINE","length":9.238,"vertices":[[4.619,8.0003427,0.0],[9.238,0.0,0.0]]},"signature_hash":"0e6131e646daf131ab88930c0e921eb51d1fcfac0069907275e42606b14d415f"},{"entity_id":"edge_102d540b25d9","raw_occt_index":8,"signature":{"bbox":{"diagonal":48.27,"xlen":0.0,"xmax":-4.619,"xmin":-4.619,"ylen":0.0,"ymax":8.0003427,"ymin":8.0003427,"zlen":48.27,"zmax":48.27,"zmin":0.0},"center":[-4.619,8.0003427,24.135],"geometry_type":"LINE","length":48.27,"vertices":[[-4.619,8.0003427,0.0],[-4.619,8.0003427,48.27]]},"signature_hash":"102d540b25d945769c9dcb09921ed8db0950def2a63004beb97de3cd35980cd6"},{"entity_id":"edge_2162ce6279b3","raw_occt_index":15,"signature":{"bbox":{"diagonal":9.238,"xlen":4.619,"xmax":-4.619,"xmin":-9.238,"ylen":8.0003427,"ymax":0.0,"ymin":-8.0003427,"zlen":0.0,"zmax":48.27,"zmin":48.27},"center":[-6.9285,-4.0001713,48.27],"geometry_type":"LINE","length":9.238,"vertices":[[-9.238,0.0,48.27],[-4.619,-8.0003427,48.27]]},"signature_hash":"2162ce6279b3b7e27d0e24c43d49488bef995527e80a4d3895fe90eeea6d020a"},{"entity_id":"edge_2d67db0c3980","raw_occt_index":5,"signature":{"bbox":{"diagonal":9.238,"xlen":4.619,"xmax":9.238,"xmin":4.619,"ylen":8.0003427,"ymax":-0.0,"ymin":-8.0003427,"zlen":0.0,"zmax":48.27,"zmin":48.27},"center":[6.9285,-4.0001713,48.27],"geometry_type":"LINE","length":9.238,"vertices":[[4.619,-8.0003427,48.27],[9.238,0.0,48.27]]},"signature_hash":"2d67db0c3980cfe84b39c35d946e1ff71c6f9de4bc52b2663859b237f5d3cd41"},{"entity_id":"edge_3d2cd5f3efcf","raw_occt_index":23,"signature":{"bbox":{"diagonal":13.6471609,"xlen":9.65,"xmax":4.825,"xmin":-4.825,"ylen":9.65,"ymax":4.825,"ymin":-4.825,"zlen":0.0,"zmax":52.13,"zmin":52.13},"center":[0.0,0.0,52.13],"geometry_type":"CIRCLE","length":30.3163691,"radius":4.825,"vertices":[[4.825,0.0,52.13]]},"signature_hash":"3d2cd5f3efcf6d150bae7b700af687945dc78f07a6bf241982d92826494dd11c"},{"entity_id":"edge_422f6c051b36","raw_occt_index":14,"signature":{"bbox":{"diagonal":9.238,"xlen":4.619,"xmax":-4.619,"xmin":-9.238,"ylen":8.0003427,"ymax":8.0003427,"ymin":0.0,"zlen":0.0,"zmax":48.27,"zmin":48.27},"center":[-6.9285,4.0001713,48.27],"geometry_type":"LINE","length":9.238,"vertices":[[-9.238,0.0,48.27],[-4.619,8.0003427,48.27]]},"signature_hash":"422f6c051b36372014ddf8d70b6bb